{
  "profile": "finance/dev",
  "events": [
    {
      "id": "obs:artifact",
      "kind": "observation",
      "type": "finance.message.received",
      "ts": "2026-02-24T16:40:46.115908Z",
      "data": {
        "modality": "document",
        "artifact": {
          "uri": "https://example.org/artifact.bin",
          "hash": "sha256:eab762a03fd979a04cc4706e6536d382bc89d2d1356afcd054a16b2235ecd471",
          "content_type": "application/octet-stream",
          "bytes": 1234
        }
      }
    },
    {
      "id": "der:calc",
      "kind": "derivation",
      "type": "finance.transaction.recorded",
      "ts": "2026-02-24T16:40:46.115908Z",
      "refs": [
        "obs:artifact"
      ],
      "method": "system",
      "confidence": 0.9,
      "uncertainty": {
        "kind": "stddev",
        "value": 0.05,
        "unit": "1"
      },
      "data": {
        "name": "score",
        "value": 0.73,
        "unit": "1"
      }
    },
    {
      "id": "clm:rca",
      "kind": "claim",
      "type": "finance.exception.detected",
      "ts": "2026-02-24T16:40:46.115908Z",
      "refs": [
        "der:calc"
      ],
      "method": "model",
      "confidence": 0.58,
      "data": {
        "statement": "Model suggests condition X likely"
      }
    },
    {
      "id": "cue:act",
      "kind": "cue",
      "type": "finance.settlement.updated",
      "ts": "2026-02-24T16:40:46.115908Z",
      "refs": [
        "clm:rca"
      ],
      "data": {
        "channel": "system",
        "intent": "recommend",
        "urgency": "high",
        "payload": {
          "action": "do_the_thing",
          "why_ref": "clm:rca"
        }
      }
    }
  ],
  "provenance": {
    "artifacts": [
      {
        "uri": "https://example.org/artifact.bin",
        "hash": "sha256:eab762a03fd979a04cc4706e6536d382bc89d2d1356afcd054a16b2235ecd471",
        "content_type": "application/octet-stream",
        "bytes": 1234
      }
    ],
    "transform_chain": [
      {
        "tool": {
          "name": "bridge.reference",
          "version": "0.1"
        },
        "inputs": [
          "obs:artifact"
        ],
        "outputs": [
          "der:calc"
        ],
        "params_hash": "sha256:03fb69249703e3d5f3679e1af1fc2d19cfdd3e1f54cc80d60e8de1ccd09a0381",
        "ts": "2026-02-24T16:40:46.115908Z"
      }
    ]
  },
  "extensions": {
    "finance": {
      "_x": {
        "producer": "reference_bridge"
      }
    }
  }
}
