{
  "profile": "social/dev",
  "events": [
    {
      "id": "obs:artifact",
      "kind": "observation",
      "type": "social.post.created",
      "ts": "2026-02-24T16:40:46.115032Z",
      "data": {
        "modality": "document",
        "artifact": {
          "uri": "https://example.org/artifact.bin",
          "hash": "sha256:3e860f41a5ea92c49803d6ec96d452693b6dcefb0e8c0bf0125b0e3debac5281",
          "content_type": "application/octet-stream",
          "bytes": 1234
        }
      }
    },
    {
      "id": "der:calc",
      "kind": "derivation",
      "type": "social.reply.created",
      "ts": "2026-02-24T16:40:46.115032Z",
      "refs": [
        "obs:artifact"
      ],
      "method": "system",
      "confidence": 0.9,
      "uncertainty": {
        "kind": "stddev",
        "value": 0.05,
        "unit": "1"
      },
      "data": {
        "name": "score",
        "value": 0.73,
        "unit": "1"
      }
    },
    {
      "id": "clm:rca",
      "kind": "claim",
      "type": "social.network.signal",
      "ts": "2026-02-24T16:40:46.115032Z",
      "refs": [
        "der:calc"
      ],
      "method": "model",
      "confidence": 0.58,
      "data": {
        "statement": "Model suggests condition X likely"
      }
    },
    {
      "id": "cue:act",
      "kind": "cue",
      "type": "social.cue.request_sources",
      "ts": "2026-02-24T16:40:46.115032Z",
      "refs": [
        "clm:rca"
      ],
      "data": {
        "channel": "system",
        "intent": "recommend",
        "urgency": "high",
        "payload": {
          "action": "do_the_thing",
          "why_ref": "clm:rca"
        }
      }
    }
  ],
  "provenance": {
    "artifacts": [
      {
        "uri": "https://example.org/artifact.bin",
        "hash": "sha256:3e860f41a5ea92c49803d6ec96d452693b6dcefb0e8c0bf0125b0e3debac5281",
        "content_type": "application/octet-stream",
        "bytes": 1234
      }
    ],
    "transform_chain": [
      {
        "tool": {
          "name": "bridge.reference",
          "version": "0.1"
        },
        "inputs": [
          "obs:artifact"
        ],
        "outputs": [
          "der:calc"
        ],
        "params_hash": "sha256:b375dad0a012a12f065a080d1d923dd8c9fec5372635e2c30195b7f065da8bbb",
        "ts": "2026-02-24T16:40:46.115032Z"
      }
    ]
  },
  "extensions": {
    "social": {
      "_x": {
        "producer": "reference_bridge"
      }
    }
  }
}
